{
  "schema_version": "trace/v0.1",
  "trace_id": "agent-loop-context/incorrect",
  "title": "An over-broad context causes the tool response to be wrong",
  "seed": 7,
  "source": {
    "controller.py": "request = read_request()\ncontext = select_context(request)\nobservation = call_tool(context)\nreturn observation\n"
  },
  "events": [
    {
      "id": "e0",
      "logical_time": 0,
      "actor": "controller",
      "operation": "read_request",
      "source_span": {"file": "controller.py", "line": 1},
      "state_delta": {"request": "show build status", "steps": 1},
      "observation": "The learner request is available to the controller.",
      "causal_parents": [],
      "assertions": []
    },
    {
      "id": "e1",
      "logical_time": 1,
      "actor": "controller",
      "operation": "select_context",
      "source_span": {"file": "controller.py", "line": 2},
      "state_delta": {"context": ["repository/status.json", "repository/secrets.example"], "steps": 2},
      "observation": "The context packet includes an unrelated file.",
      "causal_parents": ["e0"],
      "assertions": ["a0"]
    },
    {
      "id": "e2",
      "logical_time": 2,
      "actor": "tool",
      "operation": "read_status",
      "source_span": {"file": "controller.py", "line": 3},
      "state_delta": {"observation": "unknown", "steps": 3},
      "observation": "The tool response is not the requested build status.",
      "causal_parents": ["e1"],
      "assertions": ["a1"]
    }
  ],
  "assertions": [
    {
      "id": "a0",
      "kind": "invariant",
      "description": "Context contains only the requested status input.",
      "event_id": "e1",
      "status": "fail",
      "evidence": "state.context includes repository/secrets.example"
    },
    {
      "id": "a1",
      "kind": "prediction",
      "description": "Reading status returns green for this fixture.",
      "event_id": "e2",
      "status": "fail",
      "evidence": "state.observation equals unknown"
    }
  ],
  "text_fallback": "At e1 the controller includes an unrelated file, violating the context invariant. At e2 the tool returns unknown rather than green, so the prediction fails."
}
